date_time_start,pscis_crossing_id,my_crossing_reference,crew_members,surveyor_1,surveyor_2,surveyor_3,aggregated_crossings_id,camera_id,site_id,gps_id,moti_chris_culvert_id,gps_waypoint_number,stream_name,road_name,road_km_mark,road_tenure,crossing_type,crossing_subtype,crossing_fix,diameter_or_span_meters,length_or_width_meters,assessment_comment,habitat_comment,date,continuous_embeddedment_yes_no,average_depth_embededdment_meters,resemble_channel_yes_no,backwatered_yes_no,percentage_backwatered,fill_depth_meters,outlet_drop_meters,outlet_pool_depth_0_01m,inlet_drop_yes_no,culvert_slope_percent,downstream_channel_width_meters,stream_slope,beaver_activity_yes_no,fish_observed_yes_no,valley_fill,habitat_value,stream_width_ratio,culvert_length_score,embed_score,outlet_drop_score,culvert_slope_score,stream_width_ratio_score,final_score,barrier_result,recommended_diameter_or_span_meters,source,time_start,mergin_user,utm_corrected,erosion_issues,embankment_fill_issues,blockage_issues,condition_rank,condition_notes,likelihood_flood_event_affecting_culvert,consequence_flood_event_affecting_culvert,climate_change_flood_risk,vulnerability_rank,climate_notes,traffic_volume,community_access,cost,constructability,fish_bearing,environmental_impacts,priority_rank,overall_rank,priority_notes,photo_road,photo_upstream,photo_downstream,photo_inlet,photo_barrel,photo_outlet,photo_condition,photo_embankment_fill,photo_blockage,photo_extra1,photo_extra2,photo_extra1_tag,photo_extra2_tag,dewatering,dewatering_notes,photo_dewatering,velocity,velocity_notes,photo_velocity,constriction,constriction_notes,photo_constriction,substrate,substrate_notes,photo_substrate,riparian,riparian_notes,photo_riparian,flow_depth,flow_depth_notes,photo_flow_depth,stability,stability_notes,photo_stability,revegetation,revegetation_notes,photo_revegetation,cover,cover_notes,photo_cover,maintenance,maintenance_notes,photo_maintenance,uav_flight,fish_sampling,site_card_filled,photo_extra3,photo_extra4,photo_extra3_tag,photo_extra4_tag,site_name,site_name_wfn,new_site,works_completed,citation_key,utm_zone,easting,northing
2024-09-23T17:48:42Z,,,,AI,LS,,,AI,,AI,,68,Bulkley River,,,,CBS,ROUND,,50,150,Upstream Wilson site on left bank corner where access to hay field pinches.   Natural riparian adjacent is a mix of willow and young cottonwood with a few spruce young and is located approximately 20 m from the current eroded bank. Landowner has reported that he could move the road to much further away to access the field in behind. This would allow the current riparian to help protect the bank as erosion progresses.          ,"Appears to be potentially bank swallow holes in the bank, approximately 3/4 of the way downstream from the top          ",,,,,,,,,,,,10,,Yes,,,MEDIUM,,,,,,,,,,,,,,,,,,,,,,,,,,,,,,,,,,photos/20240923_112426.jpg,photos/20240923_112433.jpg,photos/20240923_112523.jpg,photos/20240923_112419.jpg,photos/20240923_112519.jpg,,,,photos/20240923_112534.jpg,,Uav survey plan,,,,,,,,,,,,Substrate is covered with substantial amounts of algae and is primarily gravel throughout          ,photos/20240923_111839.jpg,1,"Riparian adjacent to the erosion is hayfield with a mix of economic, grasses, and red canary grass along the immediate edge. Significant slumping of sections of field into the stream.          ",photos/20240923_111741.jpg,3,Range from 0.45 to 1m at current water levels. Deepest area is the downstream curve where force and erosion is greatest.,photos/20240923_111949.jpg,1,"Range of incision depths to water surface is 1.8 to 2.6m. To estimated high water is between 0.6 and 0.Bank is full failing throughout with greatest amount of erosion notable near bank swallow Ness, approximately 3/4 of the way down the bank.          ",photos/20240923_111728.jpg,2,"This site has not had work done to it yet, but riparian in problem area is a hayfield however, there is riparian on the south side of the stream approximately 20 m away from the routing bank, consisting of primarily Willows and young immature Cottonwood with some young spruce.          ",,1,Very minimal cover available throughout the site at low water flow with some areas of minor cover near where slabs of field have fallen into the river.          ,,,"No previous works at site
",,Yes,,,photos/20240923_112007.jpg,,Swallow holes,,bulkley_wilson_01,,yes,no,,9,663208,6039654
2024-09-23T19:24:28Z,,,,AI,LS,,,,,,,69,Bulkley River,,,,CBS,ROUND,,50,80,Log jam on right bank with mature old growth cottonwood forest on downstream end and young cottonwood forest and willow comprising riparian upstream.  Landowner reports that stream floods adjacent field to the north almost every year with 2023 and 2024 being exceptions.  Landowner reports that the logjam began approximately six years ago and with one or two logs and is now approximately 70 or 80 full-size pieces of wood.  Point of concern for erosion is on downstream end near 90° corner where log jam is located.          ,,,,,,,,,,,,,,,Yes,,,HIGH,,,,,,,,,,,,,,,,,,,,,,,,,,,,,,,,,,photos/20240923_125038.jpg,photos/20240923_125048.jpg,photos/20240923_125134.jpg,,photos/20240923_125136.jpg,,,,photos/20240923_125652.jpg,,Cottonwood old growth,,2,Site is wetted ,,,,,,,,1,Fine substrate throughout. ,photos/20240923_124755.jpg,1,Downstream end of site is old growth Cottonwood Forest with upstream being young Cottonwood Forest with Willow.  Along area of erosion is primarily reed canary grass with some Canada thistle.           ,photos/20240923_124650.jpg,1,"Flow depths range .45,0.55,0.8, 0.85",photos/20240923_124853.jpg,,"Incision current 2.0 , 2.1, 2.1 with high water incision 0.4, 0, 0.  Land owner reports that most active erosion is at the downstream side of the log jam where the 90° turn in the river occurs.          ",photos/20240923_124559.jpg,1,"Occasional willows very rare along the edge of the hayfield, but Pont primarily canary grass with some thistle          ",,,Logjam is providing large amounts of cover throughout the site. Fish observed.          ,photos/20240923_124604.jpg,,,,,,,photos/20240923_124926.jpg,,,,bulkley_wilson_02,,yes,no,,9,662437,6038835
2024-09-23T20:43:57Z,,,,AI,LS,,,AI,,AI,,70,Bulkley River,,,,CBS,ROUND,,110,50,Right bank of river located downstream of Wilson residence.  Very fine clay is undercutting the bank with extensive erosion. Just upstream is section of river highlighted as important chinook habitat by sources from the toboggan hatchery in the past.          ,,,,,,,,,,,,,,,,,,MEDIUM,,,,,,,,,,,,,,,,,,,,,,,,,,,,,,,,,,photos/20240923_134656.jpg,photos/20240923_134739.jpg,photos/20240923_134727.jpg,,photos/20240923_134732.jpg,,,,,,,,1,Deep along bank,,,,,,,,,Fines throughout.,photos/20240923_135800.jpg,,Primarily willow downstream with young cottonwood and willow upstream on same bank. Edge of erosion in hay field.,photos/20240923_135726.jpg,,"Range 0.6, 0.65, 1.0, 1.5",,1,"Incision current 2.5, 2.3, 2.1 and high water estimated at 0.85, 0.85, 0.6Active slumping of field into river here.",photos/20240923_135252.jpg,1,No natural vegetation in erosion area.,,1,Clay banks are undercut with depths of up to 1.5m so could provide cover. No overhanging vegetation or woody debris.,photos/20240923_135605.jpg,,,,No,,,,,,,bulkley_wilson_03,,yes,no,,9,661714,6038747
2024-09-23T22:33:52Z,,,,AI,LS,,,Ai,,AI,,62,Bulkley River,,,,CBS,ROUND,,50,50,Adjacent to Craker Road. Prescription from WFN/LGL not implemented at this site in 2017. Old van in the river at this location. Cottonwood snag across entire wetted channel width. Right bank of the river with less pronounced erosion than many other sites.          ,,,,,,,,,,,,,,,,,,MEDIUM,,,,,,,,,,,,,,,,,,,,,,,,,,,,,,,,,,photos/20240923_153847.jpg,photos/20240923_153934.jpg,photos/20240923_153926.jpg,photos/20240923_153842.jpg,photos/20240923_153930.jpg,,,,,,,,1,Good flow at this location ,,,,,2,Narrower here with more bank on other side than we have seen at other sites. If channel encroaches could consider removing material from other side to avoid constriction.,,1,Fine substrates,photos/20240923_154051.jpg,2,"Primarily narrow shrub, repair and upstream and shrub with occasional Cottonwood downstream.          ",photos/20240923_154031.jpg,2,"Flows 1.5, 1.2, 1.6",photos/20240923_154131.jpg,,"Incision current 2.5, 2.7, 2.1. High water incision 1.0, 0.5, 0.6",photos/20240923_154009.jpg,,Some natural willow generation along slumped banks but primarily agronomic grasses,,2,"Old van in the river, providing minimal cover and several pieces of large wood debris at bottom of corner.          ",,1,,,Yes,,,photos/20240923_154143.jpg,,Lwd across ,,bulkley_meints_craker_rd_upper,Bulkley R - Craker Rd - Upper,,no,@gaboury_smith2016DevelopmentAquatic,9,660674,6037618
2024-09-23T22:57:36Z,,,,AI,LS,,,AI,,AI,,63,Bulkley River,,,,CBS,ROUND,,50,200,WFN/LGL site prescription location but not implemented. Right Bank of river where erosion and flows appears to potentially be the slower than other sections of stream.  Deep water with some large wood debris out in the middle of the channel.                             ,,,,,,,,,,,,,,,,,,,,,,,,,,,,,,,,,,,,,,,,,,,,,,,,,,,,photos/20240923_160121.jpg,photos/20240923_160137.jpg,photos/20240923_160128.jpg,photos/20240923_160116.jpg,photos/20240923_160133.jpg,,,,photos/20240923_160214.jpg,,Lwd,,1,Very deep section.,,2,Slack water with near zero gradient ,,,,,1,Fine substrate,photos/20240923_160846.jpg,1,"Primarily shrugged right and upstream and narrow, mature, mixed forest downstream. Agronomic grasses in area adjacent to erosion.          ",photos/20240923_160738.jpg,3,"0.65, 0.95, 1.6, 1.6",,1," Incision current 2.4, 2.4, 2.3. High water 1.1, 1.0, 1.1.  Slumping occurring, but appears to be not as rapid as other areas.",photos/20240923_160653.jpg,,"No shrub regeneration in area of erosion, only grasses and weeds, including Canada thistle.",,,Deep channel in this area with some LWD in centre of site and channel.,,,,,Yes,,,,,,,bulkley_meints_craker_rd_middle,Bulkley R - Craker Rd - Middle,,no,@gaboury_smith2016DevelopmentAquatic,9,660646,6037455
2024-09-23T23:24:46Z,,,,AI,LS,,,AI,,AI,,71,Bulkley River,,,,CBS,ROUND,,50,100,WFN/LGL implementated prescription site.  Six LWD structures and some rock armouring.  Bank appears to be stable.  No fencing. Some deep pools scoured behind lower structures.  Decent cottonwood regeneration at downstream end of site with willow dispersed with agronomic grasses and Canada thistle.  Upper end of site with poor riparian generation besides a narrow strip of willow.   ,,,,,,,,,,,,,,,,,,,,,,,,,,,,,,,,,,,,,,,,,,,,,,,,,,,,photos/20240923_162958.jpg,photos/20240923_163019.jpg,photos/20240923_163010.jpg,photos/20240923_162954.jpg,photos/20240923_163014.jpg,,,,,,,,3,Good flow at site.,,3,Small riffle at third structure from top then primarily run. ,,3,Structures appear to be in good shape with intact root balls and stable. Minimal collection of Woody debris material and some minor scour present.          ,photos/20240923_164922.jpg,,Mostly cobble choked with algae.,photos/20240923_164856.jpg,2,"Some good Cottonwood regeneration, particularly at the downstream end of the site. Some willow establishment as well mixed in with agronomic grasses and some Thistle.          ",photos/20240923_164849.jpg,2,"0.85, 1.0, 0.3",,4,"Incision current 2.4, 2.0, 2.2. High water incision 0.9, 0.8, 0.6.",photos/20240923_164820.jpg,3,"Decent regeneration within narrow right. Corridor ranging from 3 m to top of the bank to 12 m. Some Cottonwood regrowth, as well as Willow mixed with agronomic, grasses and dill.",photos/20240923_164753.jpg,4, Large Woody debris structures have created some areas of shallow pool cover adjacent to the structures on upstream end with areas of deep water scoured out for last two strictures.,photos/20240923_164832.jpg,5,"There is no maintenance required for the actual structures however, fencing could be put in place and reparian width could be increased as well as density of plants.          ",,Yes,,,,,,,bulkley_meints_craker_rd_lower,Bulkley R - Craker Rd - Lower,,yes,@gaboury_smith2016DevelopmentAquatic,9,660290,6037248
